[
  {
    "id": "sunny",
    "name": "はれ",
    "move_type_multiplier": { "ほのお": 1.5, "みず": 0.5 },
    "defender_stat_multiplier": {},
    "additional_effects": [
      "ソーラービームが1ターンで発動する（通常は2ターン技）",
      "くさタイプの技『しんぴのしずく』等の天候依存効果は対象外（威力倍率のみ対応）"
    ]
  },
  {
    "id": "rain",
    "name": "あめ",
    "move_type_multiplier": { "みず": 1.5, "ほのお": 0.5 },
    "defender_stat_multiplier": {},
    "additional_effects": [
      "『かみなり』『ぼうふう』の命中が100%になる"
    ]
  },
  {
    "id": "sandstorm",
    "name": "すなあらし",
    "move_type_multiplier": {},
    "defender_stat_multiplier": {
      "いわ": { "stat": "sp_defense", "multiplier": 1.5 }
    },
    "additional_effects": [
      "いわ・じめん・はがねタイプ以外は、ターン終了時に最大HPの1/16のダメージを受ける"
    ]
  },
  {
    "id": "snow",
    "name": "ゆき",
    "move_type_multiplier": {},
    "defender_stat_multiplier": {
      "こおり": { "stat": "defense", "multiplier": 1.5 }
    },
    "additional_effects": [
      "『ふぶき』の命中が100%になる"
    ]
  }
]
